{"capture_method":"manual_browser_visible_text","capture_scope":"bounded_official_excerpts_not_full_page","captured_at":"2026-07-28T07:56:49Z","captured_text":"Each meta-review should summarize the key points that justify your accept/reject recommendation, whether from the reviews themselves or the (anonymized) discussions.\n\nYour recommendations and meta-reviews should be informed by the review content, as opposed to just relying on average (or other aggregate) numerical scores.\n\nIf authors raised concerns about poor quality of reviews and/or disengaged reviewers, please assure them that you as an AC have read their rebuttals/comments and incorporated them in your decision making.\n\nimportant contradictions between reviews, or if any key aspects of the paper remain unclear to a reviewer","schema_version":"1.0.0","source_id":"icml-2026-ac-instructions","url":"https://icml.cc/Conferences/2026/AreaChairInstructions"}
