{"capture_method":"manual_browser_visible_text","capture_scope":"bounded_official_excerpts_not_full_page","captured_at":"2026-07-28T07:56:49Z","captured_text":"Justified recommendation (clearly connecting your assessment to your rating)\n\nYour final justification should be specific, evidence-based, and clearly connected to your rating","schema_version":"1.0.0","source_id":"cvpr-2026-training","url":"https://cvpr.thecvf.com/Conferences/2026/ReviewerTrainingMaterial"}
