{"capture_method":"manual_browser_visible_text","capture_scope":"bounded_official_excerpts_not_full_page","captured_at":"2026-07-28T07:56:49Z","captured_text":"comments that reflect reading the rebuttal, the other reviews, and the discussion with the other reviewers\n\nall reviewers have entered the Final Recommendation and that this is consistent with their Final Justification\n\nSummarize how the reviews, the authors’ rebuttal, and the discussion support your preliminary decision.\n\nconsider the Contribution Types chosen by the authors in your meta-review\n\nDon't focus too much on the scores. Instead, look carefully at the comments.\n\nJudge the quality of the review rather than taking note of the reviewer's confidence score; the latter may be more a measure of personality.","schema_version":"1.0.0","source_id":"eccv-2026-ac-guidelines","url":"https://eccv.ecva.net/Conferences/2026/ACGuideLines"}
