{"capture_method":"manual_browser_visible_text","capture_scope":"bounded_official_excerpts_not_full_page","captured_at":"2026-07-28T07:56:49Z","captured_text":"Yes/No answer to this first TMLR decision criteria, along with an explanation.\n\nYes/No answer to this second TMLR decision criteria, along with an explanation.\n\nDecision recommendation (accept, leaning accept, leaning reject or reject)","schema_version":"1.0.0","source_id":"tmlr-reviewer-guide","url":"https://jmlr.org/tmlr/reviewer-guide.html"}
