{"capture_method":"manual_browser_visible_text","capture_scope":"bounded_official_excerpts_not_full_page","captured_at":"2026-07-28T07:56:49Z","captured_text":"primarily evaluate each submission through the lens of the contribution type selected by the authors\n\nreviewers should assess the work holistically\n\nnot as a rigid checklist\n\nonly if this decision is made explicit and carefully justified in the review\n\nThis justification should be stated explicitly in the “Justification of Rating” section of the review","schema_version":"1.0.0","source_id":"eccv-2026-contribution-types","url":"https://eccv.ecva.net/Conferences/2026/ReviewerContributionTypes"}
