{"capture_method":"manual_browser_visible_text","capture_scope":"bounded_official_excerpts_not_full_page","captured_at":"2026-07-28T07:56:49Z","captured_text":"Are the claims made in the submission supported by accurate, convincing and clear evidence?\n\nOften, this will lead reviewers to ask the authors to provide more evidence by running more experiments.\n\nAnother is simply for the authors to adjust (reduce) their claims.\n\nWould some individuals in TMLR's audience be interested in the findings of this paper?\n\nCrucially, it should not be used as a reason to reject work that isn't considered “significant” or “impactful” because it isn't achieving a new state-of-the-art on some benchmark.\n\nNor should it form the basis for rejecting work on a method considered not “novel enough”, as novelty of the studied method is not a necessary criteria for acceptance.\n\nTMLR instead relies on certifications (such as “Featured” and “Outstanding”) to provide annotations on submissions that pertain to (more speculative) assertions on significance or potential for impact.","schema_version":"1.0.0","source_id":"tmlr-acceptance-criteria","url":"https://jmlr.org/tmlr/acceptance-criteria.html"}
