{"capture_method":"manual_browser_visible_text","capture_scope":"bounded_official_excerpts_not_full_page","captured_at":"2026-07-28T07:56:49Z","captured_text":"There are 3 possible outcomes: Accept, Accept with minor revision and Reject","schema_version":"1.0.0","source_id":"tmlr-ae-guide","url":"https://jmlr.org/tmlr/ae-guide.html"}
