{"capture_method":"manual_browser_visible_text","capture_scope":"bounded_official_excerpts_not_full_page","captured_at":"2026-07-28T07:56:49Z","captured_text":"technically sound and make a contribution to the field\n\nYour main critique of the paper should be written in terms of a list of strengths and weaknesses.\n\nYour detailed review, more than your score, will help the authors, fellow reviewers, and Area Chairs understand the basis for your recommendation\n\nthe fact that a proposed method does not exceed the state-of-the-art accuracy on an existing benchmark dataset is not grounds for rejection by itself\n\nweigh both the novelty and potential impact of the work alongside the reported performance\n\nMinor flaws that can be easily corrected should not be a reason to reject a paper.","schema_version":"1.0.0","source_id":"cvpr-2026-reviewer-guidelines","url":"https://cvpr.thecvf.com/Conferences/2026/ReviewerGuidelines"}
