{"capture_method":"manual_browser_visible_text","capture_scope":"bounded_official_excerpts_not_full_page","captured_at":"2026-07-28T07:56:49Z","captured_text":"technically sound and make a contribution to the field\n\nLook for what is good or stimulating in the paper, and what knowledge advancement it has made.\n\ndoes not exceed the state-of-the-art accuracy on an existing benchmark dataset is not grounds for rejection by itself\n\nweigh both the novelty and potential impact of the work alongside the reported performance\n\nMinor flaws that can be easily corrected should not be a reason to reject a paper.","schema_version":"1.0.0","source_id":"eccv-2026-reviewer-guide","url":"https://eccv.ecva.net/Conferences/2026/ReviewerGuide"}
