{"capture_method":"manual_browser_visible_text","capture_scope":"bounded_official_excerpts_not_full_page","captured_at":"2026-07-28T07:56:49Z","captured_text":"You will be asked on the review form to answer several questions for each paper.\n\nIs the submission technically sound? Are claims well supported\n\nAre the methods used appropriate?\n\nIf the paper includes theoretical results, are the proofs correct and based on reasonable assumptions?\n\nIf the paper includes empirical results, are the experiments well-designed?\n\nIs the submission clearly written and well structured?\n\nIs the overall narrative easy to follow?\n\nDoes the work properly position itself in the context of prior/concurrent literature and clearly discuss how it differs?\n\na superbly written paper provides enough information for an expert reader to reproduce its results.\n\nDoes the paper address an important or relevant problem?\n\nDoes it advance understanding, capabilities, or practice in machine learning?\n\nCould it influence future research or applications\n\nDoes the work provide new insights, deepen understanding, or highlight important properties of existing methods?\n\nDoes the work introduce new tasks, methods, theory, data, or perspectives that advance the field in some dimensions?\n\nDoes this work offer a novel combination of existing techniques, and is the reasoning behind this combination well-articulated?\n\nLimitations\n\nHave the authors adequately discussed the limitations and potential negative societal impact of their work?\n\nEthical Concerns\n\nIf you believe there are ethical issues with this paper, please flag the paper for an ethics review.\n\nIf you flagged this paper for ethics review, please explain your concerns in detail.\n\nSoundness\n\n4: excellent\n3: good\n2: fair\n1: poor\n\nPresentation\n\n4: excellent\n3: good\n2: fair\n1: poor\n\nSignificance\n\n4: excellent\n3: good\n2: fair\n1: poor\n\nOriginality\n\n4: excellent\n3: good\n2: fair\n1: poor\n\nMain Track Reviewer Form Instructions\n\nOverall Recommendation\n\n6: Strong Accept: Technically flawless paper with exceptional impact on one or more areas of AI, with strong evaluation, reproducibility, and resources, and no unaddressed ethical considerations.\n\n5: Accept: Technically solid paper, with high impact on at least one sub-area of AI or moderate-to-high impact on more than one area of AI, with good-to-excellent evaluation, resources, reproducibility, and no unaddressed ethical considerations.\n\n4: Weak accept: Technically solid paper that advances at least one sub-area of AI, with a contribution that others are likely to build on, but with some weaknesses that limit its impact (e.g., limited evaluation). Please use sparingly.\n\n3: Weak reject: A paper with clear merits, but also some weaknesses, which overall outweigh the merits. Papers in this category require revisions before they can be meaningfully built upon by others. Please use sparingly.\n\n2: Reject: For instance, a paper with technical flaws, weak evaluation, inadequate reproducibility, incompletely addressed ethical considerations, or writing so poor that it is not possible to understand its key claims.\n\n1: Strong Reject: For instance, a paper with well-known results, unaddressed ethical considerations, or a poorly written paper where it is impossible to tell what the nature of its contribution is.\n\nMain Track Reviewer Form Instructions\n\nPlease provide a \"confidence score\" for your assessment of this submission\n\n5: You are absolutely certain about your assessment. You are very familiar with the related work and checked the math/other details carefully.\n\n4: You are confident in your assessment, but not absolutely certain. It is unlikely, but not impossible, that you did not understand some parts of the submission or that you are unfamiliar with some pieces of related work.\n\n3: You are fairly confident in your assessment. It is possible that you did not understand some parts of the submission or that you are unfamiliar with some pieces of related work. Math/other details were not carefully checked.\n\n2: You are willing to defend your assessment, but it is quite likely that you did not understand the central parts of the submission or that you are unfamiliar with some pieces of related work. Math/other details were not carefully checked.\n\n1: Your assessment is an educated guess. The submission is not in your area, or the submission was difficult to understand. Math/other details were not carefully checked.\n\nMain Track Reviewer Form Instructions\n\nFinal Justification (Post-Rebuttal)\nPlease explain your final recommendation, taking into account both the paper and the authors’ rebuttal. Summarize how you weighed the strengths and weaknesses across dimensions such as soundness, originality, significance, and clarity. Importantly, please indicate whether the rebuttal addressed your main concerns, changed your evaluation, or reinforced your prior assessment.","schema_version":"1.0.0","source_id":"icml-2026-reviewer-instructions","url":"https://icml.cc/Conferences/2026/ReviewerInstructions"}
