{"capture_method":"manual_browser_visible_text","capture_scope":"bounded_official_excerpts_not_full_page","captured_at":"2026-07-28T07:56:49Z","captured_text":"A good meta-review summarizes the paper’s contribution\n\nhighlights the main points of the reviewers’ initial assessment\n\ndiscusses the arguments of the rebuttal\n\nsummarizes the reviewers’ reason for their final recommendation\n\nconcludes with the recommendation of the AC and its underlying rationale","schema_version":"1.0.0","source_id":"cvpr-2026-ac-guidelines","url":"https://cvpr.thecvf.com/Conferences/2026/ACGuides"}
